{
  "amendment_id": "s4_4_data_expansion_amendment_01",
  "bindings": {
    "access_policy_file_sha256": "58e7b5e21907bb26f87dec621990ef538c26a562f0532de5fc59178dbcbf8c4f",
    "aggregate_index_file_sha256": "3ba47b6e5b20228dfbe8d2382dba3505bfe0ae0c3bad892fd3812f6d36d86a9c",
    "config_file_sha256": "f4b98b894e10da5a679dcf3d5e2e8a6562a9d1aa3bfb8ce6f6a7644e38940a31",
    "fit_a_manifest_file_sha256": "75e5298cbe7cd9cb1a489b4e975972499ee161a505f63450f39eb6838ff03f45",
    "fit_b_manifest_file_sha256": "8d612bb6ad92e553e13b000261e0ae4031be80bd8aa3b34cca4e990b6169e97c",
    "fit_partition_manifest_file_sha256": "e8b8cb83e20aa06781f8c7fd8641271df116ccb3a8e7f54e9c6ecbd1046fed8d",
    "holdout_partition_manifest_file_sha256": "cf89f82d4a50283183b6ab5fd803eaa9e95a47f4ff51da4024c3e64f20e92cb6",
    "holdout_seal_intent_file_sha256": "593a0ccee30d4e80569abf0a24f115868970248136a268c9a819b3c11705c165",
    "holdout_session_manifest_file_sha256": "be1cc185d1c3393b0de6a596c4ea12472a172d35e6947a7d4511f8a83249fb4e",
    "schema_s4_4_amendment_aggregate_index_v1_schema_sha256": "6077dcc080a1e07083a940fa4b1c489d1a6bcaa0b075e96fdd8502e5125f7d10",
    "schema_s4_4_amendment_attempt_census_v1_schema_sha256": "e999c8cc2403a5c9280b65c3ef49e0b9bb912916a598b8328185c3db0f1018e5",
    "schema_s4_4_amendment_manifest_v1_schema_sha256": "232bcf2aa9516ce7bec0f0a5538bfb6e6d524636e82fabecb0ac3aa261663e3e",
    "schema_s4_4_amendment_precollection_seal_v1_schema_sha256": "e0618a7646a8d47d7bf4054dd1e756886889f382b3adc78735bfa7ffe4cd2ca3",
    "schema_s4_4_amendment_session_preflight_v1_schema_sha256": "213d64aac5925af7b36f7bb9f363fe253bf38d1b5f69cebe7ce70f3da4eae115",
    "schema_s4_4_amendment_technical_qa_v1_schema_sha256": "089e90fc0f805927f06f3e80e034e1bb4e389aa6e9763e629d1a576ec7eab57d"
  },
  "collection_allowed": true,
  "grouping_policy_sha256": "d371677887ddec0da3ae6838f5cc013489f86ea3c55377c09b14cf750df15b7b",
  "historical_record_set_sha256": "d55317a6e99ed7e8befac22dac0fe036466f98beb4ae48fd5973de9158e8b50b",
  "historical_split_plan_payload_sha256": "1569c00cbaec57e5625e0876fd243e17a2a67b287b3edf9865e41bb7ce8c0ce3",
  "identity_contract_sha256": "579718d80a5ec352e0616910f883656784c78ae54702495d771b813456b7e103",
  "replacement_policy_sha256": "0eb2a0c71d847ba2eff758e4d5261bd13caaf250ef38d760b897a9420e15dcc4",
  "retention_policy_sha256": "7e958d160272d49d34b3fc46ade276fc65702fbe6ec8b05fe1f95ec9e8dd3c2f",
  "s4_5_or_later_started": false,
  "schema": "ias.s4_4.amendment_precollection_seal.v1",
  "seal_payload_sha256": "7cb35431a87edbdd9c2c1622f48ae0e4e8141bf8fb89be4908615bc02e37d626",
  "source_checkpoint": {
    "checkpoint_sha256": "70368560f4b1400bc50f2d7f43be1beeea264bb8798072f5359a7cf509ace662",
    "commit": "f1a45cfcbfe991cf92de605270004c93b08fbeb2",
    "source_records": [
      {
        "path": "configs/s4_4_data_expansion_amendment_01.v1.json",
        "sha256": "f4b98b894e10da5a679dcf3d5e2e8a6562a9d1aa3bfb8ce6f6a7644e38940a31"
      },
      {
        "path": "docs/development/specs/s4_4_data_expansion_amendment_01.md",
        "sha256": "fd3c5387872d67ff8de0484d725b716bc643b4c6462cfdce3770bfa008984493"
      },
      {
        "path": "docs/schemas/s4_4_amendment_aggregate_index.v1.schema.json",
        "sha256": "6077dcc080a1e07083a940fa4b1c489d1a6bcaa0b075e96fdd8502e5125f7d10"
      },
      {
        "path": "docs/schemas/s4_4_amendment_attempt_census.v1.schema.json",
        "sha256": "e999c8cc2403a5c9280b65c3ef49e0b9bb912916a598b8328185c3db0f1018e5"
      },
      {
        "path": "docs/schemas/s4_4_amendment_manifest.v1.schema.json",
        "sha256": "232bcf2aa9516ce7bec0f0a5538bfb6e6d524636e82fabecb0ac3aa261663e3e"
      },
      {
        "path": "docs/schemas/s4_4_amendment_precollection_seal.v1.schema.json",
        "sha256": "e0618a7646a8d47d7bf4054dd1e756886889f382b3adc78735bfa7ffe4cd2ca3"
      },
      {
        "path": "docs/schemas/s4_4_amendment_session_preflight.v1.schema.json",
        "sha256": "213d64aac5925af7b36f7bb9f363fe253bf38d1b5f69cebe7ce70f3da4eae115"
      },
      {
        "path": "docs/schemas/s4_4_amendment_technical_qa.v1.schema.json",
        "sha256": "089e90fc0f805927f06f3e80e034e1bb4e389aa6e9763e629d1a576ec7eab57d"
      },
      {
        "path": "scripts/build_s4_4_amendment.py",
        "sha256": "2402da39fb6fd759814cd5bdd5933eb9e3629aadf6211990d424f46f702a979f"
      },
      {
        "path": "scripts/run_s4_4_amendment_take.py",
        "sha256": "1d0fca50b2abdd5c9bbd784c5d10c9d24feabc14a903e671a5afe0376b31992b"
      },
      {
        "path": "scripts/validate_s4_4_amendment.py",
        "sha256": "4c6f3c3c523dbbf05a234f9608529d7da6b2c7d72ebef05b29ddd514a1f3668d"
      },
      {
        "path": "src/isaac_audio_sensors/acquisition/s4_4_amendment.py",
        "sha256": "614fd287dbf85cc60a1782b21ed9cde5f3690c14c8722ab2d968024612c5e272"
      },
      {
        "path": "tests/test_s4_4_amendment.py",
        "sha256": "03cd24550dfafcc3f667fcccf0702dc18e284c23b43c246e5eb178ff88fce89d"
      }
    ]
  },
  "status": "committed"
}
